Nome,Preco,Avaliacao,Relevancia,Ranking_Final,Link,Filtros_Pesquisados,Detalhes - Erro
"Notebook Lenovo IdeaPad 1 Ryzen 5 7520U 15,6"" 8GB SSD 512GB Linux 82X5S00500",2081.65,5.0,4,0.9859660643423132,https://www.zoom.com.br/notebook/notebook-lenovo-ideapad-1-82x5s00500-amd-ryzen-5-7520u-15-6-8gb-ssd-512-gb-linux?_lc=88&searchterm=notebook,"Sem filtro, Mais Relevantes, Melhor Avaliados, Menor Preço",Nenhum dado técnico encontrado.
"Notebook Lenovo IdeaPad 1 AMD Ryzen 3 7320U 15,6"" 4GB SSD 256GB Windows 11 82X5000EBR",1931.16,4.8,3,0.8550234489069388,https://www.zoom.com.br/notebook/notebook-lenovo-ideapad-1-82x5000ebr-amd-ryzen-3-7320u-15-6-4gb-ssd-256-gb-windows-11?_lc=88&searchterm=notebook,"Sem filtro, Melhor Avaliados, Menor Preço",Nenhum dado técnico encontrado.
"Notebook Positivo Vision C15 Lumina Bar Celeron 8GB 128GB eMMC, Tela 15 polegadas HD Antirreflexo, Windows 11, Tecla Link, Cinza – 2 ANOS DE GARANTIA",1729.0,4.8,2,0.7327872263246062,https://www.zoom.com.br/notebook/notebook-positivo-vision-c15-lumina-bar-celeron-8gb-128gb-emmc-tela-15-polegadas-hd-antirreflexo-windows-11-tecla-link-cinza-2-anos-de-garantia?_lc=88&searchterm=notebook,"Melhor Avaliados, Menor Preço",Nenhum dado técnico encontrado.
"Notebook Lenovo IdeaPad 1 AMD Ryzen 5 7520U 15,6"" 8GB SSD 512GB Windows 11 82X5000GBR",2252.34,4.9,2,0.7296325207757242,https://www.zoom.com.br/notebook/notebook-lenovo-ideapad-1-82x5000gbr-amd-ryzen-5-7520u-15-6-8gb-ssd-512-gb-windows-11?_lc=88&searchterm=notebook,"Sem filtro, Melhor Avaliados",Nenhum dado técnico encontrado.
"Notebook Asus X515MA-BR933WS Intel Celeron N4020 15,6"" 4GB SSD 128 GB Windows 11",1899.0,4.7,2,0.7264631159120447,https://www.zoom.com.br/notebook/notebook-asus-x515ma-br933ws-intel-celeron-n4020-15-6-4gb-ssd-128-gb-windows-11?_lc=88&searchterm=notebook,"Melhor Avaliados, Menor Preço",Nenhum dado técnico encontrado.
